{
  "$schema": "https://json-schema.org/draft/2020-12/schema",
  "$id": "https://deskagent.xepanda.com/schemas/envelope_request.json",
  "title": "DeskAgentRequestEnvelope",
  "description": "Standard request envelope for Desk Agent R1 cross-module RPC and tools dispatch",
  "type": "object",
  "required": ["schema_version", "request_id", "operation", "arguments", "expires_at"],
  "additionalProperties": false,
  "properties": {
    "schema_version": {
      "type": "string",
      "enum": ["1.0.0"],
      "description": "Protocol contract version"
    },
    "request_id": {
      "type": "string",
      "minLength": 8,
      "maxLength": 64,
      "pattern": "^[a-zA-Z0-9_-]+$",
      "description": "Unique idempotency identifier generated by the caller. Retries must retain the same request_id."
    },
    "operation": {
      "type": "string",
      "pattern": "^[a-z0-9_]+(\\.[a-z0-9_]+)+$",
      "description": "Target operation in domain.action format (e.g., ha.execute, codex.submit)"
    },
    "arguments": {
      "type": "object",
      "description": "Operation-specific payload"
    },
    "expires_at": {
      "type": "string",
      "format": "date-time",
      "description": "ISO 8601 UTC timestamp after which the request must be discarded without execution"
    },
    "task_id": {
      "type": "string",
      "minLength": 1,
      "maxLength": 64,
      "description": "Associated high-level task identifier"
    },
    "session_id": {
      "type": "string",
      "minLength": 1,
      "maxLength": 64,
      "description": "Associated session or dialogue turn identifier"
    },
    "client_id": {
      "type": "string",
      "minLength": 1,
      "maxLength": 64,
      "description": "Identifier of the requesting subsystem (e.g., tclaw-firmware, edge-application, win-companion)"
    }
  }
}
