{
  "schema_version": "1.0.0",
  "request_id": "req-rem-create-005",
  "operation": "reminder.create",
  "arguments": {
    "reminder_id": "rem-daily-standup",
    "title": "Team daily standup meeting",
    "due_at": "2026-10-12T10:00:00Z",
    "timezone": "Asia/Shanghai",
    "repeat_rule": "FREQ=DAILY;INTERVAL=1",
    "priority": "high"
  },
  "expires_at": "2026-10-12T00:00:00Z",
  "client_id": "tclaw-firmware"
}
