{
  "schema_version": "1.0.0",
  "request_id": "req-cam-acq-008",
  "operation": "resource.camera.acquire",
  "arguments": {
    "client_id": "lan-web-viewer",
    "lease_duration_ms": 10000,
    "format": "jpeg",
    "target_fps": 3.0
  },
  "expires_at": "2026-10-12T00:00:00Z",
  "client_id": "edge-application"
}
