{
  "schema_version": "1.0.0",
  "request_id": "req-codex-appr-004",
  "operation": "codex.respond_approval",
  "arguments": {
    "approval_id": "appr-cmd-run-8871",
    "task_id": "tsk-codex-fix-99",
    "decision": "approve",
    "reason": "User confirmed running tests via voice command"
  },
  "expires_at": "2026-10-12T00:00:00Z",
  "task_id": "tsk-codex-fix-99",
  "client_id": "tclaw-firmware"
}
