{
  "schema_version": "1.0.0",
  "request_id": "req-note-create-006",
  "operation": "note.create",
  "arguments": {
    "note_id": "not-groceries-01",
    "title": "Weekend Shopping List",
    "content": "Buy coffee beans, oat milk, and AAA batteries",
    "tags": ["personal", "shopping"]
  },
  "expires_at": "2026-10-12T00:00:00Z",
  "client_id": "tclaw-firmware"
}
